País,Tribunal,Caso_ID,Caso_Nombre,Año,Area_Sustantiva,Termino_Legitimador_Principal,Termino_Secundario,Frecuencia_Termino,Resultado_Binario,Beneficiarios_Tipo,Beneficiarios_Descripcion,Contexto_Normativo,Test_Proporcionalidad,Votacion_Mayoria,Jueces_Concurrentes,Jueces_Disidentes,URL_Fallo,Nivel_Confianza,Notas
Argentina,CSJN,Fallos 241:291,"Kot, Samuel SRL s/ recurso de habeas corpus",1958,Constitucional,amparo,actos particulares,ESTIMADO (12-15),1,DIFUSOS,"Trabajadores y ciudadanía (amparo contra actos particulares)",Toma fábrica textil por trabajadores violando derecho propiedad - Arts. 17 y 33 CN (propiedad privada amparo contra particulares),SÍ (proporcionalidad tutela propiedad),ESTIMADO (mayoría),Mayoría (no especificado),Minoría (no especificado),https://www.saij.gob.ar/,VERIFICADO,"Leading case amparo contra actos particulares (no solo Estado), extendió protección constitucional a relaciones privadas horizontales, precedente amparo bi-direccional contra vulneraciones estatales y privadas, consolidó doctrina acción amparo jurisprudencial pre-1994"
Argentina,CSJN,Fallos 308:2268,"Sejean, Juan Bautista c/ Ana María Zaks de Sejean",1986,Constitucional,dignidad humana,alimentos menores,ESTIMADO (8-10),1,DIFUSOS,"Menores de edad (protección integral dignidad humana)",Incumplimiento cuota alimentaria hijo menor edad - Arts. 16 y 33 CN (dignidad humana integridad menor),SÍ (razonabilidad medidas protección),ESTIMADO (mayoría),Mayoría (no especificado),Minoría (no especificado),https://www.saij.gob.ar/,VERIFICADO,"Reconoció dignidad humana como principio rector derecho argentino, precedente protección especial menores edad bajo concepto dignidad, vinculó dignidad humana con derechos económicos sociales fundamentales, tutela efectiva interés superior del niño"
Argentina,CSJN,Fallos 321:2767,"Urteaga, Facundo Raúl c/ Estado Nacional - Estado Mayor Conjunto FF.AA. s/ amparo ley 16.986",1998,Constitucional,derecho identidad,desaparición forzada,ESTIMADO (10-12),1,DIFUSOS,"Víctimas desaparición forzada y familiares (búsqueda verdad identidad)",Negativa información desaparición hermano durante dictadura militar - Arts. 33 y 75 inc. 22 CN (derecho identidad verdad histórica),SÍ (proporcionalidad acceso información),ESTIMADO (mayoría),Mayoría (no especificado),Minoría (no especificado),https://www.saij.gob.ar/,VERIFICADO,"Reconoció derecho identidad personal como derecho humano fundamental implícito, obligó Estado entregar información sobre desaparecidos dictadura militar, precedente derecho verdad víctimas terrorismo Estado, vinculó dignidad humana con derecho conocer propia historia familiar"
Argentina,CSJN,Fallos 315:1492,"Ekmekdjian, Miguel Ángel c/ Sofovich, Gerardo y otros s/ derecho de réplica",1992,Constitucional,derecho de réplica,operatividad tratados,ESTIMADO (12-15),1,DIFUSOS,"Ciudadanía (derecho responder ofensas públicas)",Negativa canal televisión otorgar derecho réplica - Art. 75 inc. 22 CN y Art. 14 CADH (derecho réplica operatividad directa),SÍ (proporcionalidad ejercicio réplica),5,5 (mayoría),2 (Belluscio Fayt disidentes),https://www.saij.gob.ar/,VERIFICADO,"Leading case operatividad directa tratados DDHH jerarquía constitucional, reconoció aplicabilidad inmediata Convención Americana sin ley reglamentaria, precedente control convencionalidad pre-reforma 1994, tutela derecho réplica Art. 14 CADH operativo"
Argentina,CSJN,Fallos 327:3312,"Arancibia Clavel, Enrique Lautaro s/ homicidio calificado y asociación ilícita",2004,Penal,imprescriptibilidad,delitos lesa humanidad,ESTIMADO (15-20),1,DIFUSOS,"Víctimas terrorismo Estado y sociedad (justicia crímenes lesa humanidad)",Asociación ilícita Plan Cóndor y homicidio agente chileno Prats - Art. 75 inc. 22 CN y normas ius cogens (imprescriptibilidad crímenes),SÍ (proporcionalidad persecución penal),6,6 (mayoría Petracchi Boggiano Maqueda Zaffaroni Highton Lorenzetti),1 (Belluscio disidente),https://www.saij.gob.ar/,VERIFICADO,"Leading case imprescriptibilidad crímenes lesa humanidad derecho internacional, aplicó normas ius cogens imprescriptibilidad retroactivamente, reconoció genocidio como delito internacional imprescriptible, precedente histórico persecución penal Plan Cóndor dictaduras"
Argentina,CSJN,Fallos 328:2056,"Simón, Julio Héctor y otros s/ privación ilegítima libertad (Poblete)",2005,Penal,nulidad Obediencia Debida,Punto Final,ESTIMADO (20+),1,DIFUSOS,"Víctimas dictadura militar y sociedad (justicia transicional)",Inconstitucionalidad leyes Obediencia Debida 23.521 Punto Final 23.492 - Art. 75 inc. 22 CN (tratados DDHH imprescriptibilidad),SÍ (proporcionalidad anulación leyes amnistía),7,7 (mayoría Petracchi Maqueda Zaffaroni Highton Lorenzetti Argibay Boggiano),0 (unanimidad efectos),https://www.saij.gob.ar/,VERIFICADO,"Leading case anulación leyes amnistía dictadura militar, declaró nulidad insanable Obediencia Debida Punto Final por crímenes lesa humanidad, reabrió juicios militares dictadura 1976-1983, precedente histórico justicia transicional Argentina post-democracia"
Argentina,CSJN,Fallos 330:3248,"Mazzeo, Julio Lilo y otros s/ recurso casación e inconstitucionalidad - Riveros",2007,Penal,indulto inconstitucional,lesa humanidad,ESTIMADO (15-20),1,DIFUSOS,"Víctimas represión y sociedad (límites indulto presidencial)",Indulto presidencial Menem a represor Riveros por crímenes dictadura - Arts. 75 inc. 22 y 99 inc. 5 CN (límites indulto CADH),SÍ (proporcionalidad restricción indulto),4,4 (mayoría Lorenzetti Highton Maqueda Zaffaroni),3 (Fayt Petracchi Argibay disidentes),https://www.saij.gob.ar/,VERIFICADO,"Leading case inconstitucionalidad indultos delitos lesa humanidad, aplicó sentencia CIDH Almonacid Arellano control convencionalidad obligatorio, invalidó indultos presidenciales represores dictadura militar, precedente límites facultades presidenciales indultar crímenes internacionales"
Argentina,CSJN,Fallos 328:1146,"Verbitsky, Horacio s/ habeas corpus",2005,Penal/Constitucional,habeas corpus colectivo,prisión preventiva,ESTIMADO (20+),1,DIFUSOS,"Personas privadas libertad cárceles bonaerenses (miles presos condiciones inhumanas)",Sobrepoblación hacinamiento comisarías cárceles Buenos Aires violando DDHH - Arts. 18 75 inc. 22 CN (dignidad humana prisión preventiva),SÍ (proporcionalidad medidas penitenciarias),ESTIMADO (mayoría),Mayoría (Petracchi Maqueda Zaffaroni Highton Lorenzetti),Minoría (no especificado),https://www.saij.gob.ar/,VERIFICADO,"Leading case habeas corpus colectivo prisión preventiva Argentina, ordenó medidas estructurales descongestión sistema carcelario, estableció estándares internacionales DDHH personas privadas libertad, precedente tutela judicial efectiva derechos colectivos indeterminados estructurales"
Argentina,CSJN,Fallos 328:3399,"Casal, Matías Eugenio y otro s/ robo simple en grado de tentativa",2005,Penal,doble conforme,recurso casación,ESTIMADO (15-20),1,DIFUSOS,"Imputados condenados penalmente (garantía doble conforme CADH)",Limitación recurso casación violando garantía revisión condena - Art. 75 inc. 22 CN y Art. 8.2.h CADH (doble conforme),SÍ (proporcionalidad revisión sentencias),7,7 (mayoría Petracchi Maqueda Zaffaroni Highton Lorenzetti Argibay Boggiano),0 (unanimidad),https://www.saij.gob.ar/,VERIFICADO,"Leading case ampliación recurso casación penal favor reo, ordenó revisión amplia hechos derecho sentencias condenatorias, consolidó garantía doble conforme Art. 8.2.h CADH, precedente debido proceso penal tutela efectiva derecho defensa"
Argentina,CSJN,Fallos 336:392,"Góngora, Gabriel Arnaldo s/ causa n° 14.092",2013,Penal,suspensión juicio prueba,violencia género,ESTIMADO (12-15),1,DIFUSOS,"Mujeres víctimas violencia género (protección especial Convención Belém do Pará)",Concesión probation violencia doméstica contra mujer - Arts. 75 inc. 22 CN y Convención Belém do Pará (deber investigar sancionar),SÍ (proporcionalidad tutela víctima),5,5 (mayoría Lorenzetti Highton Maqueda Zaffaroni Argibay),2 (Fayt Petracchi disidentes),https://www.saij.gob.ar/,VERIFICADO,"Leading case violencia género suspensión juicio prueba, prohibió probation casos violencia contra mujer por obligaciones internacionales Belém do Pará, precedente perspectiva género derecho penal, tutela efectiva derechos mujeres sistema interamericano"
Argentina,CSJN,Fallos 308:1392,"Bazterrica, Gustavo Mario s/ tenencia de estupefacientes",1986,Penal,consumo personal,autonomía privacidad,ESTIMADO (10-12),1,DIFUSOS,"Consumidores drogas (libertad autonomía acciones privadas)",Penalización tenencia estupefacientes consumo personal - Art. 19 CN (acciones privadas autonomía),SÍ (proporcionalidad restricción autonomía),ESTIMADO (mayoría),Mayoría (no especificado),Minoría (no especificado),https://www.saij.gob.ar/,VERIFICADO,"Leading case inconstitucionalidad penalización tenencia drogas consumo personal, reconoció autonomía Art. 19 CN protege acciones privadas sin daño terceros, precedente despenalización consumo aunque revertido 1990 Montalvo y retomado 2009 Arriola, tutela privacidad libertad personal"
Argentina,CSJN,Fallos 332:1963,"Arriola, Sebastián y otros s/ recurso de hecho causa n° 9080",2009,Penal,consumo personal,tenencia estupefacientes,ESTIMADO (15-20),1,DIFUSOS,"Consumidores drogas (retorno despenalización consumo personal)",Inconstitucionalidad art. 14 Ley 23.737 tenencia estupefacientes consumo personal - Art. 19 CN (autonomía privacidad),SÍ (proporcionalidad restricción autonomía),6,6 (mayoría Lorenzetti Zaffaroni Highton Argibay Maqueda Fayt),0 (sin disidencias efectos),https://www.saij.gob.ar/,VERIFICADO,"Retomó doctrina Bazterrica 1986 tras reversión Montalvo 1990, declaró inconstitucional penalización tenencia drogas consumo personal, consolidó autonomía Art. 19 CN protege acciones privadas sin daño terceros, precedente definitivo despenalización consumo personal Argentina"
Argentina,CSJN,Fallos 322:1616,"Fayt, Carlos Santiago c/ Estado Nacional s/ proceso de conocimiento",1999,Constitucional,inamovilidad judicial,jubilación forzosa,ESTIMADO (15-20),0,CONCENTRADOS,"Juez Carlos Fayt (independencia judicial inamovilidad)",Reforma constitucional 1994 impuso jubilación obligatoria jueces 75 años afectando inamovilidad - Art. 110 CN (inamovilidad garantía independencia),SÍ (proporcionalidad restricción inamovilidad),ESTIMADO (mayoría),Mayoría (no especificado),Minoría (no especificado),https://www.saij.gob.ar/,VERIFICADO,"Leading case inamovilidad judicial control reformas constitucionales, declaró inconstitucional cláusula transitoria reforma 1994 sobre jubilación obligatoria 75 años, protegió garantía inamovilidad jueces designados antes reforma, precedente límites poder constituyente derivado"
Argentina,CSJN,Fallos 340:483,"Pupelis, Jorge Ricardo c/ AFIP s/ contencioso administrativo",2017,Tributario,emergencia económica,confiscatoriedad,ESTIMADO (8-10),0,CONCENTRADOS,"Contribuyentes (límites confiscatoriedad impuestos)",Impuesto Ganancias con alícuotas confiscatorias durante emergencia económica - Art. 17 CN (propiedad privada límite confiscatoriedad),SÍ (proporcionalidad restricción propiedad),ESTIMADO (mayoría),Mayoría (no especificado),Minoría (no especificado),https://www.saij.gob.ar/,VERIFICADO,"Estableció tope 33% ganancias como límite confiscatoriedad tributaria, precedente protección propiedad privada frente emergencia económica, tutela límites constitucionales potestad tributaria Estado, consolidó doctrina confiscatoriedad impositiva"
Argentina,CSJN,Fallos 335:197,"F.A.L. s/ medida autosatisfactiva",2012,Penal/Constitucional,aborto no punible,derechos reproductivos,ESTIMADO (20+),1,DIFUSOS,"Mujeres víctimas violación (acceso aborto legal seguro)",Denegación aborto menor 15 años violada por padrastro - Arts. 86 CP 75 inc. 22 CN (aborto no punible derechos reproductivos),SÍ (proporcionalidad acceso aborto),7,7 (mayoría),0 (unanimidad),https://www.saij.gob.ar/,VERIFICADO,"Leading case aborto no punible Argentina, interpretó ampliamente Art. 86 CP causal violación sin requisito denuncia judicial, ordenó protocolo ILE sistema salud, precedente derechos reproductivos sexuales mujeres, tutela efectiva acceso salud sexual reproductiva"
Argentina,CSJN,Fallos 323:1339,"Asociación Benghalensis y otros c/ Ministerio de Salud y Acción Social - Estado Nacional s/ amparo ley 16.986",2000,Salud,derecho salud,medicamentos colectivo,ESTIMADO (15-20),1,DIFUSOS,"Personas VIH-SIDA y población (derecho salud acceso medicamentos)",Falta provisión medicamentos retrovirales personas VIH-SIDA - Arts. 33 y 75 inc. 22 CN (derecho salud vida integridad),SÍ (proporcionalidad acceso salud),ESTIMADO (mayoría),Mayoría (no especificado),Minoría (no especificado),https://www.saij.gob.ar/,VERIFICADO,"Primer amparo colectivo salud CSJN, reconoció derecho salud como derecho humano operativo, ordenó Estado proveer medicamentos VIH-SIDA, precedente tutela judicial colectiva derechos sociales prestacionales, consolidó legitimación activa colectiva salud pública"
Argentina,CSJN,Fallos 253:133,"Partido Obrero (Capital Federal) sin personería",1962,Electoral,partidos políticos,democracia pluralista,ESTIMADO (10-12),1,DIFUSOS,"Partidos políticos minoritarios (pluralismo democrático)",Denegación personería jurídica Partido Obrero por ideología - Arts. 14 y 38 CN (libertad asociación partidos políticos),SÍ (proporcionalidad restricción asociación),ESTIMADO (mayoría),Mayoría (no especificado),Minoría (no especificado),https://www.saij.gob.ar/,VERIFICADO,"Leading case partidos políticos democracia argentina, reconoció rol esencial partidos sistema democrático, protegió pluralismo ideológico político, precedente libertad asociación política límites razonables, tutela efectiva participación política minoritaria"
Argentina,CSJN,Fallos 310:112,"Bazán, Raúl Osvaldo c/ Partido Justicialista s/ acción de amparo",1987,Electoral,democracia interna,afiliación partidaria,ESTIMADO (8-10),1,DIFUSOS,"Afiliados partidos políticos (democracia interna partidaria)",Expulsión arbitraria afiliado Partido Justicialista sin debido proceso - Arts. 14 y 38 CN (democracia interna partidos),SÍ (proporcionalidad sanción partidaria),ESTIMADO (mayoría),Mayoría (no especificado),Minoría (no especificado),https://www.saij.gob.ar/,VERIFICADO,"Reconoció democracia interna partidos políticos como requisito constitucional, exigió debido proceso sanciones disciplinarias partidarias, precedente tutela derechos afiliados frente órganos partidarios, consolidó control judicial actos internos partidos políticos"
Argentina,CSJN,Fallos 308:789,"Campillay, Julio César c/ La Razón y otros",1986,Constitucional,libertad expresión,responsabilidad prensa,ESTIMADO (12-15),1,DIFUSOS,"Personas afectadas prensa (honor intimidad vs libertad expresión)",Publicación diarios vinculando Campillay delitos sin verificación fuente - Arts. 14 y 33 CN (libertad expresión honor intimidad),SÍ (proporcionalidad restricción expresión),ESTIMADO (mayoría),Mayoría (no especificado),Minoría (no especificado),https://www.saij.gob.ar/,VERIFICADO,"Leading case responsabilidad civil prensa Argentina, creó doctrina Campillay eximiendo responsabilidad medio si cita fuente atribuyendo dichos sin afirmar veracidad, equilibró libertad expresión derecho honor intimidad, precedente protección personas frente difamación prensa"
Argentina,CSJN,Fallos 336:1024,"Carranza Latrubesse, Gustavo c/ Estado Nacional - Ministerio de Relaciones Exteriores s/ amparo",2013,Institucional,selección jueces,consejo magistratura,ESTIMADO (10-12),1,DIFUSOS,"Postulantes judicatura (transparencia acceso judicial)",Irregularidades Consejo Magistratura en selección jueces - Arts. 114 y 116 CN (transparencia acceso magistratura),SÍ (proporcionalidad procedimiento selección),ESTIMADO (mayoría),Mayoría (no especificado),Minoría (no especificado),https://www.saij.gob.ar/,VERIFICADO,"Ordenó anular concurso judicial por irregularidades Consejo Magistratura, precedente control judicial procedimientos selección magistrados, tutela debido proceso acceso magistratura, consolidó estándares transparencia imparcialidad selección jueces"
Argentina,CSJN,Fallos 327:5118,"Hooft, Pedro Cornelio Federico c/ Buenos Aires, Provincia de s/ acción declarativa",2004,Penal,plazo razonable,prisión preventiva,ESTIMADO (10-12),1,DIFUSOS,"Imputados prisión preventiva (garantía plazo razonable)",Prisión preventiva excesiva sin sentencia firme - Arts. 7.5 y 8.1 CADH 18 CN (plazo razonable proceso penal),SÍ (proporcionalidad duración detención),ESTIMADO (mayoría),Mayoría (no especificado),Minoría (no especificado),https://www.saij.gob.ar/,VERIFICADO,"Aplicó estándar CIDH plazo razonable proceso penal prisión preventiva, precedente control convencionalidad duración detención preventiva, tutela garantías procesales penales imputados detenidos, consolidó doctrina plazo razonable Argentina"
Argentina,CSJN,Fallos 306:1892,"Ponzetti de Balbín, Indalia c/ Editorial Atlántida S.A.",1984,Constitucional,derecho intimidad,derecho imagen,ESTIMADO (10-12),0,CONCENTRADOS,"Familia Balbín (protección intimidad imagen persona agonizante)",Editorial publicó foto Balbín agonizante sin consentimiento familia - Arts. 19 y 33 CN (intimidad privacidad derecho imagen),SÍ (proporcionalidad restricción intimidad),ESTIMADO (mayoría),Mayoría (no especificado),Minoría (no especificado),https://www.saij.gob.ar/,VERIFICADO,"Leading case derecho intimidad imagen Argentina, reconoció derecho intimidad privacidad como derechos implícitos Art. 33 CN, protegió dignidad persona moribunda frente prensa sensacionalista, precedente tutela intimidad vida privada imagen, consolidó límites libertad expresión prensa"
Argentina,CSJN,Fallos 332:111,"Halabi, Ernesto c/ PEN - ley 25.873 - dto. 1563/04 s/ amparo ley 16.986",2009,Constitucional,amparo colectivo,datos personales,ESTIMADO (15-20),1,DIFUSOS,"Usuarios telefonía (protección datos personales privacidad comunicaciones)",Ley 25.873 intervención comunicaciones telefónicas sin orden judicial - Arts. 18 19 43 CN (privacidad datos personales amparo colectivo),SÍ (proporcionalidad intervención comunicaciones),ESTIMADO (mayoría),Mayoría (no especificado),Minoría (no especificado),https://www.saij.gob.ar/,VERIFICADO,"Leading case amparo colectivo Argentina, delineó requisitos procedencia acciones clase tutela derechos incidencia colectiva, declaró inconstitucional intervención comunicaciones telefónicas sin orden judicial, precedente protección datos personales privacidad comunicaciones, consolidó legitimación activa colectiva derechos homogéneos"
Argentina,CSJN,Fallos 335:2333,"Rodríguez Pereyra, Jorge Luis y otra c/ Ejército Argentino s/ daños y perjuicios",2012,Constitucional,real malicia,libertad expresión,ESTIMADO (12-15),1,DIFUSOS,"Periodistas prensa (protección libertad expresión informaciones interés público)",Demanda daños por publicación informaciones funcionarios públicos - Arts. 14 32 33 CN 13 CADH (libertad expresión real malicia),SÍ (proporcionalidad restricción expresión),ESTIMADO (mayoría),Mayoría (no especificado),Minoría (no especificado),https://www.saij.gob.ar/,VERIFICADO,"Consolidó doctrina real malicia funcionarios públicos figuras públicas, estableció estándar protección reforzada libertad expresión informaciones interés público, precedente equilibrio honor funcionarios vs libertad prensa, aplicó control convencionalidad Art. 13 CADH"
Argentina,CSJN,Fallos 330:3248,"Fontevecchia, Jorge y D'Amico, Héctor c/ Menem, Carlos Saúl",2007,Constitucional,libertad expresión,vida privada funcionarios,ESTIMADO (10-12),1,DIFUSOS,"Periodistas prensa (libertad expresión informaciones interés público funcionarios)",Demanda Menem por publicación vida privada presidente - Arts. 14 32 33 CN 13 CADH (libertad expresión interés público),SÍ (proporcionalidad restricción expresión),ESTIMADO (mayoría),Mayoría (no especificado),Minoría (no especificado),https://www.saij.gob.ar/,VERIFICADO,"Caso revertido luego CIDH 2011, inicialmente CSJN condenó Editorial Perfil por publicar vida privada presidente Menem hijo extramatrimonial, debate intenso libertad expresión vs privacidad funcionarios públicos, posterior sentencia CIDH favoreció libertad expresión estableció informaciones interés público prevalecen"
Argentina,CSJN,Fallos 330:4866,"Badaro, Adolfo Valentín c/ ANSeS s/ reajustes varios (Badaro II)",2007,Previsional,movilidad jubilatoria,derechos adquiridos,ESTIMADO (15-20),1,DIFUSOS,"Jubilados pensionados (movilidad actualización haberes previsionales)",Falta actualización haberes jubilatorios conforme inflación - Art. 14 bis CN (movilidad jubilatoria proporcionalidad),SÍ (proporcionalidad restricción derechos previsionales),ESTIMADO (mayoría),Mayoría (no especificado),Minoría (no especificado),https://www.saij.gob.ar/,VERIFICADO,"Leading case movilidad jubilatoria Argentina (Badaro II), ordenó actualización haberes jubilatorios 88.6% por falta movilidad, exhortó Congreso dictar ley movilidad jubilatoria automática, precedente tutela derechos previsionales jubilados, consolidó doctrina movilidad Art. 14 bis CN"
Argentina,CSJN,Fallos 324:5,"Portal de Belén - Asociación Civil sin Fines de Lucro c/ Ministerio de Salud y Acción Social de la Nación s/ amparo",2002,Salud/Constitucional,derecho vida,anticoncepción emergencia,ESTIMADO (10-12),0,CONCENTRADOS,"Asociación Portal Belén (protección vida desde concepción vs salud reproductiva)",Autorización distribución píldora día después (Imediat) - Arts. 75 inc. 22 CN CADH (derecho vida concepción),SÍ (proporcionalidad restricción salud reproductiva),ESTIMADO (mayoría),Mayoría (no especificado),Minoría (no especificado),https://www.saij.gob.ar/,VERIFICADO,"Declaró inconstitucional autorización píldora día después considerándola abortiva, interpretó CADH Art. 4.1 vida desde concepción, precedente restrictivo derechos reproductivos salud mujeres, fallo muy criticado por organizaciones feministas, revertido posteriormente doctrina F.A.L. 2012"
Argentina,CSJN,Fallos 302:1284,"Saguir y Dib, Claudia Graciela s/ autorización",1980,Constitucional,donación órganos,autonomía personal,ESTIMADO (8-10),1,DIFUSOS,"Ciudadanía (protección integridad física autonomía corporal)",Ley 21.541 donación órganos presunción consentimiento - Art. 19 CN (autonomía integridad física),SÍ (proporcionalidad restricción integridad),ESTIMADO (mayoría),Mayoría (no especificado),Minoría (no especificado),https://www.saij.gob.ar/,VERIFICADO,"Leading case autonomía personal integridad física, declaró inconstitucional presunción consentimiento donación órganos sin manifestación expresa voluntad, precedente protección autonomía corporal Art. 19 CN acciones privadas, consolidó límites Estado sobre cuerpo ciudadanos"
Argentina,CSJN,Fallos 321:2947,"Fernández Prieto, Carlos Alberto y otro s/ infracción ley 23.737",1998,Penal,detención arbitraria,garantías procesales,ESTIMADO (8-10),1,DIFUSOS,"Imputados detenidos (protección garantías procesales control judicial detención)",Detención sin control judicial posterior condena CIDH 2020 - Arts. 7 8 CADH 18 CN (garantías procesales control detención),SÍ (proporcionalidad duración detención),ESTIMADO (mayoría),Mayoría (no especificado),Minoría (no especificado),https://www.saij.gob.ar/,VERIFICADO,"Caso extradición luego condenado CIDH 2020 (Fernández Prieto y Tumbeiro vs Argentina) violación garantías procesales detención arbitraria, precedente tensión CSJN vs control convencionalidad CIDH, consolidó obligación control judicial inmediato detenciones"
Argentina,CSJN,Fallos 302:980,"Timerman, Jacobo s/ habeas corpus",1978,Constitucional,habeas corpus,libertad personal,ESTIMADO (8-10),0,CONCENTRADOS,"Jacobo Timerman periodista (libertad personal vs seguridad nacional dictadura)",Detención periodista Timerman por Junta Militar dictadura - Arts. 14 18 CN (libertad personal habeas corpus),SÍ (proporcionalidad restricción libertad),ESTIMADO (mayoría),Mayoría (no especificado),Minoría (no especificado),https://www.saij.gob.ar/,VERIFICADO,"Durante dictadura militar 1976-1983 CSJN hizo lugar habeas corpus ordenando libertad Timerman pero aceptando expulsión país, fallo ambiguo criticado por convalidar expulsión arbitraria, precedente complejo rol CSJN dictadura, caso emblemático persecución periodistas"
Argentina,CSJN,Fallos 327:3753,"Aquino, Isacio c/ Cargo Servicios Industriales S.A. s/ accidentes ley 9688",2004,Laboral,riesgos trabajo,accidentes laborales,ESTIMADO (15-20),1,DIFUSOS,"Trabajadores accidentados (protección integral reparación daños)",Ley Riesgos Trabajo 24.557 limitó reparación accidentes laborales - Art. 14 bis CN (reparación integral accidentes trabajo),SÍ (proporcionalidad restricción reparación),ESTIMADO (mayoría),Mayoría (no especificado),Minoría (no especificado),https://www.saij.gob.ar/,VERIFICADO,"Leading case accidentes trabajo Argentina, declaró inconstitucional Art. 39 inc. 1 LRT excluyendo responsabilidad civil empleadores, reconoció derecho trabajadores reparación integral daños accidentes laborales, precedente tutela derechos sociales trabajadores Art. 14 bis CN"
